Id Ind;ID Kawak;Nombre del indicador;Unidad;Proceso/Subproceso;Descripción del indicador;Linea_Estrategica;Objetivo_Estrategico;Tipo de Indicador;Clasificación;Frecuencia;Fecha Desde;Fecha Hasta;Tipo de variables;Series;Sentido;Formula;Variable 1;Unidad V1;Fuente V1;Variable 2;Unidad V2;Fuente V2;Variable 3;Unidad V3;Fuente V3;Responsable del calculo;Responsable del analisis;Deficiente;Alerta;Satisfactorio;Sobresaliente;Meta Frecuencia;Semestre_1;Semestre_2;Deficiente <= Serie;Alerta Serie;Satisfactorio Serie;Sobresaliente >= Serie;Modificado;Creado;Creado por;Usuario_Aprobador;Fecha_Aprobación;Estado_aprobacion;Año;Estado_Indicador;PDI;CNA/SNIES;Desempeño del proceso;Decisiones Proceso;SubClasificación;Estado;Clasificación_ CNA;Formato_Evidencia;Nombre_Evidencia;Meta 1 Semestre Serie;Meta 2 Semestre Serie;Meta Anual Series;Tipo_Kawak;Factor_CNA;Caracteristica;Proyecto_Asociado;Tipo de elemento;Ruta de acceso
363;363;Seguimiento a la parametrización de aulas master y secciones de asignaturas;Vicerrectoría del estudiante;Operaciones Académicas;Asegurar la parametrización de las Máster para garantizar la salida a producción de cada una de las cohortes en su asignación de fechas y el funcionamiento de los diferentes enlaces en las asignaturas.;Experiencia;Garantizar una experiencia significativa y de valor agregado a la comunidad POLI;Gestión;Eficacia;Semestral;1/01/2023;;Serie Única;;Positivo;(N° de Aulas máster y secciones de asignaturas correctamente parametrizadas / Total de Aulas máster y secciones de asignaturas virtuales creadas en Banner) x 100;N° de Aulas máster y secciones de asignaturas correctamente parametrizadas;Número;Reporte de grupos por franja;Total de Aulas máster y secciones de asignaturas virtuales creadas en Banner;Número;Reporte de grupos por franja;;;;Líder de Ambientes de Aprendizaje;"Líder de Ambientes de Aprendizaje, Director de operaciones pregrado y posgrado

";0%-79,99%;80%  - 99,99%;100%;100%;100%;100%;100%;;;;;1/06/2026 8:42;24/02/2025 16:48;Licec Ximena Silva Goyeneche;Andrea Alfonso Ayala;;;2025;Stand by;false;false;true;true;;Eliminar;Seleccione;Excel;Grupos Por Franja Master;;;;Gestión;;;;Elemento;sites/Indicadores2/Lists/Ficha_tecnica_indicadores
364;364;Impacto de actividades de Responsabilidad y proyección;Vicerrectoría del estudiante;Gestión de la Responsabilidad Social;Impacto de actividades de Responsabilidad y proyección;Sostenibilidad;Contribuir a la inclusión, la proyección social y el cuidado del medio ambiente;Gestión;Eficacia;Semestral;1/01/2023;;Serie Única;0;Positivo;"(N° de personas impactadas/Número de personas a impactar planeadas	)*100";Número de personas impactadas;Número;Formulario de Huella;Número de personas a impactar planeadas;Número;;;;;Jefe de servicios de bienestar y huella grancolombiana, Profesional en proyección y responsabilidad social;Jefe de servicios de bienestar y huella grancolombiana, Profesional en proyección y responsabilidad social;<80%;80%-99,9%;100%-104%;>105%;83.197;33.279;49.918;;;;;5/05/2026 6:34;24/02/2025 16:48;Licec Ximena Silva Goyeneche;Juan Carlos Rivera Herrera;;;2025;Stand by;true;true;true;true;;Eliminar;Resultado;EXCEL;;;;;Estratégico;;;;Elemento;sites/Indicadores2/Lists/Ficha_tecnica_indicadores
365;365;Seguimiento de asignación docente a NRC Pregrado-Posgrado;Vicerrectoría del estudiante;Operaciones Académica pregrado y posgrado presencial.;Midel el cumplimiento al seguimiento de asignación docente en el 100% de los NRC en cada ingreso - Pregrado;Experiencia;Garantizar una experiencia significativa y de valor agregado a la comunidad POLI;Gestión;Eficacia;Semestral;1/07/2023;;Multiserie;(Multiserie Pregrado Virtual- Pregrado Presencial- Posgrado Virtual- Posgrado Presencial);Positivo;Número de NRC con docentes asignados /Total NRC creados;Número de NRC con docentes asignados;Número;;Total NRC creados;Número;;;;;Coordinador Experiencia Operativa;"Dirección Operaciones Integrales
Gerente de operaciones";0%-79.99%;80%  - 99,99%;100%;101%;;;;;;;;15/10/2025 22:25;24/02/2025 16:48;Licec Ximena Silva Goyeneche;;;;;Inactivo;;;;;;;;;;;;;Pendiente;;;;Elemento;sites/Indicadores2/Lists/Ficha_tecnica_indicadores
366;366;Normalización de cobros pecuniarios;Vicerrectoría del estudiante;Operaciones Académicas;Asegurar la normalización de cobros de estudiantes nuevos antes de pecuniarios;Experiencia;Garantizar una experiencia significativa y de valor agregado a la comunidad POLI;Gestión;Eficacia;Anual;1/01/2023;;Serie Única;;Positivo;(Numero de estudiantes con cobro de valor pecuniario normalizado/ Número de estudiantes con cobro de valor pecuniario del año pasado )*100;Numero de estudiantes con cobro de valor pecuniario normalizado;Número;Reporte de matriculados Novus;Número de estudiantes con cobro de valor pecuniario del año pasado ;Número;Reporte de matriculados Novus;;;;Jefe Procesos Financieros S.I.S y Ux;Jefe Procesos Financieros S.I.S y Ux, Director de operaciones pregrado y posgrado;0%-79,99%;80%  - 99,99%;100%;101%;100%;100%;100%;;;;;6/05/2026 12:39;24/02/2025 16:48;Licec Ximena Silva Goyeneche;Hilda Rocio Baquero Florez;;;2026;Stand by;false;false;true;true;;Actualizar Metas;Resultado;Excel;Cambio_tipo_alumno;;;;Gestión;;;;Elemento;sites/Indicadores2/Lists/Ficha_tecnica_indicadores
367;367;Estudiantes con Becas;Vicerrectoría del estudiante;Gestión de la Responsabilidad Social;Medir el nivel de estudiantes becados vs total de estudiantes;Sostenibilidad;Contribuir a la inclusión, la proyección social y el cuidado del medio ambiente;Estratégico;Eficacia;Anual;1/01/2023;;Serie Única;0;Positivo;(Total estudiantes becados/ Total de estudiantes)*100;Total becas otorgadas;Número;SNIES;Total de estudiantes;Número;SNIES;;;;Jefe de servicios de bienestar y huella grancolombiana, Coordinadora Huella Grancolombiana regional norte;Jefe de servicios de bienestar y huella grancolombiana, Coordinadora Huella Grancolombiana regional norte;3%;4%;5%-6%;>6%;5%;0;5%;;;;;5/05/2026 6:12;24/02/2025 16:48;Licec Ximena Silva Goyeneche;Juan Carlos Rivera Herrera;;;2025;Activo;true;true;true;true;;Eliminar;Resultado;EXCEL;SNIES BECAS: DBUHG050101V1;;;;Estratégico;Factor 7. Impacto social;Característica 23. Institución y entorno;Fortalecimiento de la extensión y proyección social;Elemento;sites/Indicadores2/Lists/Ficha_tecnica_indicadores
368;368;Satisfacción de los estudiantes de Educación para toda la vida;Vicerrectoría del estudiante;Operación de Nuevos Negocios y Convenios Institucionales;Mide el grado de satisfacción de los estudiantes que participan en los programas, cursos o actividades de Educación para toda la vida, con base en aspectos como la calidad del contenido, la metodología, la atención del docente, los recursos utilizados, y la organización general del proceso formativo.;Experiencia;Garantizar una experiencia significativa y de valor agregado a la comunidad POLI;Estratégico;Efectividad;Trimestral;1/01/2023;;Serie Única;;Positivo;Resultado de encuesta de satisfacción  programas presenciales, blended y  virtuales;Resultado de encuesta de satisfacción  programas presenciales, blended y virtuales;Porcentaje;CX;;;;;;;"Director de Operac. Nuevos Negocios y Ci
Coordinador Proyectos Eplv
Jefe de Proyectos B2B   
Jefe de Proyectos B2G   
Lider Articulación de Proyectos  ";Director de Operac. Nuevos Negocios y Ci;0%-79,99%;80%  - 92,99%;93%-98%;>99%;93%;93%;93%;;;;;23/06/2026 6:30;24/02/2025 16:48;Licec Ximena Silva Goyeneche;Alexandra Roman Toro;;;2026;Stand by;false;false;true;true;;Actualizar Metas;Resultado;Reporte;Reporte de CX;;;;Gestión;;;;Elemento;sites/Indicadores2/Lists/Ficha_tecnica_indicadores
369;369;Participación de POLI- voluntariados (Estudiantes- Colaboradores);Vicerrectoría del estudiante;Gestión de la Responsabilidad Social;Identificar el numero de participantes en Poli-Voluntariados;Sostenibilidad;Contribuir a la inclusión, la proyección social y el cuidado del medio ambiente;Gestión;Eficacia;Semestral;1/01/2023;;Multiserie;(Colaboradores- Estudiantes);Positivo;"(N de POLI-voluntariados del periodo	/N de POLI-voluntariados planeados en el periodo)*100";"N de POLI-voluntariados del periodo	";Número;;N de POLI-voluntariados planeados en el periodo;Número;;0;;0;Jefe de servicios de bienestar y huella grancolombiana, Profesional en proyección y responsabilidad social;Jefe de servicios de bienestar y huella grancolombiana, Profesional en proyección y responsabilidad social;0%-79,9%;80%  - 99,9%;100% -105%;>105%;236;178;236;;;;;5/05/2026 6:53;24/02/2025 16:48;Licec Ximena Silva Goyeneche;Juan Carlos Rivera Herrera;;;2026;Stand by;true;false;false;true;;Actualizar Metas;Resultado;;;"Estudiantes: 142
Colaboradores: 36";"Estudiantes: 189
Colaboradores: 47";"Estudiantes: 189
Colaboradores: 47";Estratégico;;;;Elemento;sites/Indicadores2/Lists/Ficha_tecnica_indicadores
370;370;Oportunidades de mejora - Huella Verde;Vicerrectoría del estudiante;Gestión de la Responsabilidad Social;Medir el número de oportunidades de mejora implementadas en huella verde;Sostenibilidad;Contribuir a la inclusión, la proyección social y el cuidado del medio ambiente;Gestión;Eficacia;Semestral;1/01/2023;;Serie Única;;Positivo;Número de oportunidades de mejora implementadas / Total de oportunidades de mejoras propuestas;Número de oportunidades de mejora implementadas;Número;;Total de oportunidades de mejoras propuestas;NÚMERO;;;;;Jefe de servicios de bienestar y huella grancolombiana;Jefe de servicios de bienestar y huella grancolombiana;;;;;;;;;;;;15/10/2025 22:25;24/02/2025 16:48;Licec Ximena Silva Goyeneche;;;;;Inactivo;;;;;;;;;;;;;Pendiente;;;;Elemento;sites/Indicadores2/Lists/Ficha_tecnica_indicadores
371;371;Recaudación de fondos;Vicerrectoría del estudiante;Gestión de la Responsabilidad Social;"Medir los recursos recaudados para la financiación de actividades de la institución-
(A partir de 2025 solo se tiene  en cuenta los convenios nuevos en la meta de recaudación)";Sostenibilidad;Contribuir a la inclusión, la proyección social y el cuidado del medio ambiente;Estratégico;Eficiencia;Semestral;1/01/2023;;Serie Única;;Positivo;(Monto de dinero recaudado/Monto de dinero presupuestado para el periodo)*100;"
Monto de dinero recaudado";Moneda COP;Informe de recaudo;Monto de dinero presupuestado para el periodo;Moneda COP;;;;;Jefe de servicios de bienestar y huella grancolombiana;"Jefe de servicios de bienestar y huella grancolombiana
";0%-79,9%;80%  - 99,9%;100%-104%;>105%; 304.500.000; 128.250.000; 176.250.000;;;;;5/05/2026 7:00;24/02/2025 16:48;Licec Ximena Silva Goyeneche;Juan Carlos Rivera Herrera;;;2026;Stand by;false;false;true;true;;Modificar Ficha;Resultado;EXCEL;RECAUDO ANUAL;;;;Gestión;;;;Elemento;sites/Indicadores2/Lists/Ficha_tecnica_indicadores
372;372;Satisfacción de los clientes corporativos Educación para toda la vida;Vicerrectoría del estudiante;Operación de Nuevos Negocios y Convenios Institucionales;Mide el nivel de satisfacción de las empresas que adquieren programas de formación a través de la estrategia de Educación para toda la vida. Evalúa la percepción del cliente corporativo respecto a la calidad del servicio, calidez, disposición a recomendar al Poli , el cumplimiento de los objetivos acordados, la atención recibida y la satisfacción general con el proceso.;Experiencia;Garantizar una experiencia significativa y de valor agregado a la comunidad POLI;Estratégico;Efectividad;Trimestral;1/01/2023;;Serie Única;;Positivo;Resultado de encuesta de satisfacción de clientes corporativos;Resultado de encuesta de satisfacción de clientes corporativos;Porcentaje;CX;;;;;;;"Director de operaciones nuevos negocios y CI
Coordinador Proyectos Eplv     
Jefe de Proyectos B2b   
Jefe de Proyectos B2g   
Lider Articulacion de Proyectos  ";"Director de operaciones nuevos negocios y CI
Coordinador Proyectos Eplv     
Jefe de Proyectos B2b   
Jefe de Proyectos B2g   
Lider Articulacion de Proyectos  ";0%-79,99%;80%  - 92%;93%-96%;>=96%;93%;93%;93%;;;;;27/05/2026 16:22;24/02/2025 16:48;Licec Ximena Silva Goyeneche;Alexandra Roman Toro;;;2026;Stand by;false;false;true;true;;Actualizar Metas;Resultado;Reporte;Reporte CX;;;;Gestión;;;;Elemento;sites/Indicadores2/Lists/Ficha_tecnica_indicadores
373;373;Cumplimiento de planes anuales por líneas;Gerencia de planeación y gestión;Planeación Estratégica;Identificar el nivel de cumplimiento de los planes anuales por línea estratégica;Transformación_Organizacional;Fortalecer la gestión por procesos y la toma de decisiones basada en el análisis de los datos;Gestión;Eficacia;Trimestral;1/01/2023;;Multiserie;"Líneas Estratégicas (Calidad, Expansión, Educación para toda la vida, Trasformación Organizacional
, Experiencia , Sostenibilidad";Positivo;(% Porcentaje de avance/% Porcentaje de esperado)*100;% Porcentaje de avance;Porcentaje;Plan de retos;% Porcentaje de esperado;Porcentaje;Plan de retos;;;;Especialista de planeación estratégica;Especialista de planeación estratégica;0%-79,9%;80%  - 94,8%;95% -100%;100%;100%;100%;100%;0%-79,9%;80%  - 94,9%;95% -100%;100%;15/10/2025 22:25;24/02/2025 16:48;Licec Ximena Silva Goyeneche;;;;2024;Activo;false;false;false;false;;Actualizar Metas;Resultado;;;;;;Gestión;;;;Elemento;sites/Indicadores2/Lists/Ficha_tecnica_indicadores
374;374;Disponibilidad de máster modalidad virtual;Vicerrectoría del estudiante;Operaciones Académica pregrado y posgrado virtual;Garantizar que las asignaturas que se deben ofertar cuenten con su máster creada para el inicio del módulo;Experiencia;Garantizar una experiencia significativa y de valor agregado a la comunidad POLI;Gestión;Eficacia;Semestral;1/07/2023;;Serie Única;;Positivo;(Total de Másters creadas en aplicativo/Total de asignaturas virtuales creadas en Banner) x 100;Total de Másters creadas en aplicativo;Número;;Total de asignaturas virtuales creadas en Banner;Número;;;;;Líder de Ambientes de Aprendizaje;"Dirección Operaciones Integrales
Gerente de operaciones";0%-79.99%;80%  - 99,99%;100%;101%;;;;;;;;15/10/2025 22:25;24/02/2025 16:48;Licec Ximena Silva Goyeneche;;;;;Inactivo;;;;;;;;;;;;;Pendiente;;;;Elemento;sites/Indicadores2/Lists/Ficha_tecnica_indicadores
375;375;Disponibilidad de catálogo de asignaturas pregrado y posgrado presencial;Vicerrectoría del estudiante;Operaciones Académicas;Asegurar la configuración en 100% del catálogo de asignaturas de Pregrado y Posgrado, modalidad presencial como insumo para la Programación Académica;Experiencia;Garantizar una experiencia significativa y de valor agregado a la comunidad POLI;Gestión;Eficacia;Semestral;1/01/2023;;Multiserie;(Multiserie Pregrado Virtual- Pregrado Presencial- Posgrado Virtual- Posgrado Presencial);Positivo;"N° Asignaturas activas/ Total de asignaturas catálogo general en Banner) x 100
";N° Asignaturas activas;Número;Reporte Mallas largo;Total de asignaturas catálogo general en Banner;Número;Reporte Mallas largo;;;;Jefe Funcional Procesos Academicos S.I.S;Jefe Funcional Procesos Académicos S.I.S, Director de operaciones pregrado y posgrado;0%-79,99%;80%  - 99,99%;100%;100%;100%;100%;100%;;;;;15/10/2025 22:25;24/02/2025 16:48;Licec Ximena Silva Goyeneche;Francisco Javier Joya Vargas;;;2025;Stand by;false;false;true;true;;Actualizar Metas;Resultado;Excel;Catalogo de asignaturas;;;;Gestión;;;;Elemento;sites/Indicadores2/Lists/Ficha_tecnica_indicadores
376;376;Cumplimiento EBITDA;Vicerrectoría financiera y administrativa;Planeación Financiera;"Mide el cumplimiento del EBITDA
El primer semestre corresponde al corte de junio y segundo semestre a acumulado de enero a diciembre";Sostenibilidad;Promover una cultura de optimización de recursos financieros como apalancador de la estrategia;Estratégico;Eficacia;Semestral;1/01/2023;;Serie Única;;Positivo;(EBITDA Real/ EBITDA Presupuesto)*100;EBITDA Real;MONEDA;Informe comité financiero;EBITDA Presupuesto;MONEDA;Informe comité financiero;;;;Director de Planeacion Financiera y Teso, Lider Financiero;Director de Planeacion Financiera y Teso, Lider Financiero;0%-89,9%;90%  - 99,99%;100%;>=101%;32.126.483.785;18.705.796.226;32.126.483.785;;;;;15/10/2025 22:25;24/02/2025 16:48;Licec Ximena Silva Goyeneche;Diana Paola Baquero Bernal;;;2025;Activo;true;false;true;true;;Actualizar Metas;Resultado;PPT;Informe comité financiero;;;;Estratégico;;;;Elemento;sites/Indicadores2/Lists/Ficha_tecnica_indicadores
377;377;CAPEX;Vicerrectoría financiera y administrativa;Planeación Financiera;Medir el nivel de inversión en activos a largo plazo;Sostenibilidad;Promover una cultura de optimización de recursos financieros como apalancador de la estrategia;Estratégico;Eficacia;Anual;1/01/2023;;Serie Única;;Positivo;(CAPEX Ejecutado/CAPEX Presupuestado)*100;CAPEX Ejecutado;MONEDA;Informe comité financiero;CAPEX Presupuestado;MONEDA;Informe comité financiero;;;;Director de Planeacion Financiera y Teso, Lider Financiero;Director de Planeacion Financiera y Teso, Lider Financiero;<30%;30%-49,9%;50%-100%;<100%;10.285.243.493;;10.285.243.493;;;;;15/10/2025 22:25;24/02/2025 16:48;Licec Ximena Silva Goyeneche;Diana Paola Baquero Bernal;;;2025;Activo;true;false;false;true;;Modificar Ficha;Resultado;PPT;Informe comité financiero;;;;Estratégico;;;;Elemento;sites/Indicadores2/Lists/Ficha_tecnica_indicadores
378;378;Proyectos Tecnológicos;Vicerrectoría del estudiante;Gestión De La Tecnología E Innovación Digital;Nivel de cumplimiento acumulativo en la ejecución de los proyectos de infraestructura tecnológica;Transformación_Organizacional;Asegurar una arquitectura tecnológica institucional, centrada en la experiencia de la comunidad educativa;Estratégico;Eficacia;Mensual;1/10/2022;;Multiserie;"Proyectos de mejora y nuevos requerimientos internos
Proyectos institucionales";Positivo;Porcentaje avance proyectos real / Porcentaje avance proyectos presupuestado;Porcentaje avance proyectos real;Porcentaje;;Porcentaje avance proyectos presupuestado;Porcentaje;;;;;Director de Desarrollo E Innovacion Dig.;Director de Desarrollo E Innovacion Dig.;0%-50%;51%  - 69,99%;70% -99,9%;100%;0,92;92%;0,92;;;;;15/10/2025 22:25;24/02/2025 16:49;Licec Ximena Silva Goyeneche;;;;;Activo;false;false;false;false;;Eliminar;;;;;;;Pendiente;;;;Elemento;sites/Indicadores2/Lists/Ficha_tecnica_indicadores
379;379;Total estudiantes nuevos;Vicerrectoría del crecimiento;Inscripción, admisión y matrícula de estudiantes nuevos;Medir el cumplimiento de estudiantes nuevos matriculados en la institución;Expansión;Crecer con compromiso social ;Estratégico;Eficacia;Semestral;1/01/2023;;Serie Única;;Positivo;(N° estudiantes nuevos total matriculados/N° total de estudiantes nuevos matriculados presupuestados)*100;N° estudiantes nuevos total matriculados;Número;Novus;N° total de estudiantes nuevos matriculados presupuestados;Número;Novus;;;;Gerente de Matriculas;Gerente de Matriculas;0%-79,9%;80%  - 99,99%;100%;101%;24.628;13.609;11.019;;;;;15/10/2025 22:25;24/02/2025 16:48;Licec Ximena Silva Goyeneche;Libia Ines Cabra Salinas;;;2025;Activo;true;true;true;true;;Actualizar Metas;Seleccione;Excel;Tablero de cierre Matriculados;;;;Estratégico;Factor 11. Comunidad de estudiantes;Característica 34. Admisión y permanencia de estudiantes;;Elemento;sites/Indicadores2/Lists/Ficha_tecnica_indicadores
380;380;Ingresos de matriculas de estudiantes nuevos;Vicerrectoría del crecimiento;Inscripción, admisión y matrícula de estudiantes nuevos;Identificar el nivel de ingresos generado por las matriculas de estudiantes nuevos;Sostenibilidad;Promover una cultura de optimización de recursos financieros como apalancador de la estrategia;Estratégico;Eficacia;Semestral;1/01/2023;;Serie Única;;Positivo;(Ingresos totales netos estudiantes nuevos /Total Ingresos netos presupuestados estudiantes nuevos)*100;Ingresos totales netos estudiantes nuevos;MONEDA;;Total Ingresos netos presupuestados estudiantes nuevos;MONEDA;;;;;Gerente de Matriculas;Gerente de Matriculas;0%-79,9%;80% -99,9%;100%;>101%;56.469.403.276;29.596.269.870;26.873.133.406;;;;;15/10/2025 22:25;24/02/2025 16:49;Licec Ximena Silva Goyeneche;Libia Ines Cabra Salinas;;;2024;Stand by;false;false;false;false;;Eliminar;Seleccione;;;;;;Pendiente;;;;Elemento;sites/Indicadores2/Lists/Ficha_tecnica_indicadores
381;381;Cumplimiento de matrículas pregrado presencial nuevos;Vicerrectoría del crecimiento;Inscripción, admisión y matrícula de estudiantes nuevos;Medir el cumplimiento de estudiantes nuevos matriculados en la modalidad pregrado presencial;Expansión;Crecer con compromiso social ;Gestión;Eficacia;Semestral;1/01/2023;;Serie Única;;Positivo;(N° estudiantes matriculados en pregrado presencial/Total de estudiantes presupuestados pregrado presencial)*100;N° estudiantes nuevos matriculados en pregrado presencial;Número;;Total de estudiantes presupuestados pregrado presencial;Número;;;;;Gerente de Matriculas, Director de gestión comercial y canales;Gerente de Matriculas, Director de gestión comercial y canales;0%-79,9%;80%  - 99,9%;100%;101%;2.553;1.572;981;;;;;15/10/2025 22:25;24/02/2025 16:49;Licec Ximena Silva Goyeneche;Libia Ines Cabra Salinas;;;2025;Stand by;true;false;true;true;;Actualizar Metas;Resultado;Excel;Tablero de seguimiento comercial semestral;;;;Gestión;;;;Elemento;sites/Indicadores2/Lists/Ficha_tecnica_indicadores
382;382;Cumplimiento de matrículas pregrado virtual nuevos;Vicerrectoría del crecimiento;Inscripción, admisión y matrícula de estudiantes nuevos;Medir el cumplimiento de estudiantes nuevos matriculados en la modalidad pregrado virtual;Expansión;Crecer con compromiso social ;Gestión;Eficacia;Semestral;1/01/2023;;Serie Única;;Positivo;(N° estudiantes matriculados en pregrado virtual /Total de estudiantes presupuestados pregrado virtual)*100;N° estudiantes nuevos matriculados en pregrado virtual;Número;Novus;Total de estudiantes presupuestados pregrado virtual;Número;Novus;;;;Gerente de Matriculas, Director de gestión comercial y canales;Gerente de Matriculas, Director de gestión comercial y canales;0%-79,9%;80%  - 99,9%;100%;>101%;18.574;10.067;8.507;;;;;15/10/2025 22:25;24/02/2025 16:49;Licec Ximena Silva Goyeneche;Libia Ines Cabra Salinas;;;2025;Stand by;true;false;true;true;;Actualizar Metas;Resultado;Excel;Tablero de control matriculas Semestral;;;;Gestión;;;;Elemento;sites/Indicadores2/Lists/Ficha_tecnica_indicadores
383;383;Cumplimiento de matrículas posgrado virtual nuevos;Vicerrectoría del crecimiento;Inscripción, admisión y matrícula de estudiantes nuevos;Medir el cumplimiento de estudiantes nuevos matriculados en la modalidad posgrado virtual;Expansión;Crecer con compromiso social ;Gestión;Eficacia;Semestral;1/01/2023;;Serie Única;;Positivo;(N° estudiantes matriculados en posgrados virtual/Total de estudiantes matriculados posgrado virtual presupuestados)*100;N° estudiantes nuevos matriculados en posgrados virtual;Número;Novus;Total de estudiantes matriculados posgrado virtual presupuestados;Número;Novus;;;;Gerente de Matriculas, Director de gestión comercial y canales;Gerente de Matriculas, Director de gestión comercial y canales;0%-79,9%;80%  - 99,9%;100%;>101%;2.916;1.599;1.317;;;;;15/10/2025 22:25;24/02/2025 16:49;Licec Ximena Silva Goyeneche;Libia Ines Cabra Salinas;;;2025;Stand by;true;false;true;true;;Actualizar Metas;Resultado;Excel;Tablero de control matriculas Semestral;;;;Gestión;;;;Elemento;sites/Indicadores2/Lists/Ficha_tecnica_indicadores
384;384;Cumplimiento de matrículas posgrado presencial nuevos;Vicerrectoría del crecimiento;Inscripción, admisión y matrícula de estudiantes nuevos;Medir el cumplimiento de estudiantes nuevos matriculados en la modalidad posgrado presencial;Expansión;Crecer con compromiso social ;Gestión;Eficacia;Semestral;1/01/2023;;Serie Única;;Positivo;(N° estudiantes matriculados  posgrados presencial /Total de estudiantes matriculados posgrados presencial presupuestados)*100;N° estudiantes nuevos matriculados  posgrados presencial;Número;Novus;Total de estudiantes matriculados posgrados presencial presupuestados;Número;Novus;;;;Gerente de Matriculas, Director de gestión comercial y canales;Gerente de Matriculas, Director de gestión comercial y canales;0%-79,9%;80%  - 99,9%;100%;>101%;585;371;214;;;;;15/10/2025 22:25;24/02/2025 16:49;Licec Ximena Silva Goyeneche;Libia Ines Cabra Salinas;;;2025;Stand by;true;false;true;true;;Actualizar Metas;Resultado;Excel;Tablero de control matriculas Semestral;;;;Gestión;;;;Elemento;sites/Indicadores2/Lists/Ficha_tecnica_indicadores
385;385;Ingresos totales de educación para la vida;Vicerrectoría del crecimiento;Mercadeo y venta de educación para la vida;Identificar el nivel de cumplimiento en ingresos totales generados por educación para toda la vida;Sostenibilidad;Promover una cultura de optimización de recursos financieros como apalancador de la estrategia;Estratégico;Eficacia;Semestral;1/01/2023;;Serie Única;;Positivo;(Ingresos totales de educación para la vida ejecutados/Ingresos totales de educación para la vida presupuestados)*100;Ingresos totales de educación para la vida ejecutados;MONEDA;Conciliación de planeación financiera;Ingresos totales de educación para la vida presupuestados;MONEDA;Presupuesto anual;;;;Gerente de Matriculas, Director de gestión comercial y canales;Gerente de Matriculas, Director de gestión comercial y canales;0%-79,9%;80%  - 99,9%;100%;>101%;17.058.242.411;6.845.877.310;10.212.365.100;;;;;15/10/2025 22:25;24/02/2025 16:49;Licec Ximena Silva Goyeneche;Libia Ines Cabra Salinas;;;2025;Activo;true;false;true;true;;Actualizar Metas;Resultado;Excel;Seguimiento Eduvida;;;;Estratégico;;;;Elemento;sites/Indicadores2/Lists/Ficha_tecnica_indicadores
