Id Ind;ID Kawak;Nombre del indicador;Unidad;Proceso/Subproceso;Descripción del indicador;Linea_Estrategica;Objetivo_Estrategico;Tipo de Indicador;Clasificación;Frecuencia;Fecha Desde;Fecha Hasta;Tipo de variables;Series;Sentido;Formula;Variable 1;Unidad V1;Fuente V1;Variable 2;Unidad V2;Fuente V2;Variable 3;Unidad V3;Fuente V3;Responsable del calculo;Responsable del analisis;Deficiente;Alerta;Satisfactorio;Sobresaliente;Meta Frecuencia;Semestre_1;Semestre_2;Deficiente <= Serie;Alerta Serie;Satisfactorio Serie;Sobresaliente >= Serie;Modificado;Creado;Creado por;Usuario_Aprobador;Fecha_Aprobación;Estado_aprobacion;Año;Estado_Indicador;PDI;CNA/SNIES;Desempeño del proceso;Decisiones Proceso;SubClasificación;Estado;Clasificación_ CNA;Formato_Evidencia;Nombre_Evidencia;Meta 1 Semestre Serie;Meta 2 Semestre Serie;Meta Anual Series;Tipo_Kawak;Factor_CNA;Caracteristica;Proyecto_Asociado;Tipo de elemento;Ruta de acceso
232;232;Ejecución de las Comunicaciones en Materia Ambiental;Gerencia de planeación y gestión;Gestión Ambiental;Ejecución de las Comunicaciones en Materia Ambiental;Sostenibilidad;Contribuir a la inclusión, la proyección social y el cuidado del medio ambiente;Gestión;Eficacia;Semestral;1/01/2023;;Serie Única;;Positivo;(Comunicaciones en Materia Ambiental Ejecutadas / Comunicaciones en Materia Ambiental Planificadas)*100;Comunicaciones en Materia Ambiental Ejecutadas;Número;;Comunicaciones en Materia Ambiental Planificadas;Número;;-;-;;Lider Sistema de Gestion Ambiental;Lider Sistema de Gestion Ambiental;0%-69,9%;70%  - 89,9%;90% -100%;101%;90%;90%;90%;;;;;15/10/2025 22:25;24/02/2025 16:47;Licec Ximena Silva Goyeneche;Edgar Camilo Chacon Matajudios;;;2024;Activo;;;;;;;Resultado;;;;;;Gestión;;;;Elemento;sites/Indicadores2/Lists/Ficha_tecnica_indicadores
233;233;Impacto de las Comunicaciones Correo Electrónico;Gerencia de planeación y gestión;Gestión Ambiental;Impacto de las Comunicaciones Correo Electrónico;Sostenibilidad;Contribuir a la inclusión, la proyección social y el cuidado del medio ambiente;Gestión;Eficacia;Trimestral;1/01/2023;;Serie Única;;Positivo;(Correos Electrónicos de Materia Ambiental Abiertos / Total de Correos Electrónicos de Materia Ambiental Enviados)*100;Correos Electrónicos de Materia Ambiental Abiertos;Número;;Total de Correos Electrónicos de Materia Ambiental Enviados;Número;;;;;Lider Sistema de Gestión Ambiental;Lider Sistema de Gestión Ambiental;0%-9,9%;10%  - 19,9%;20%-24%;25%;20%;20%;20%;;;;;15/10/2025 22:25;24/02/2025 16:47;Licec Ximena Silva Goyeneche;Edgar Camilo Chacon Matajudios;;;2024;Activo;;;;;;;Resultado;;;;;;Gestión;;;;Elemento;sites/Indicadores2/Lists/Ficha_tecnica_indicadores
234;234;Impacto de las Comunicaciones en Materia Ambiental a Través de Redes Sociales - Instagram;Gerencia de planeación y gestión;Gestión Ambiental;Impacto de las Comunicaciones en Materia Ambiental a Través de Redes Sociales - Instagram;Sostenibilidad;Contribuir a la inclusión, la proyección social y el cuidado del medio ambiente;Gestión;Eficacia;Trimestral;1/01/2023;;Serie Única;;Positivo;(Visualizaciones de las Publicaciones en Materia Ambiental en Instagram (medido 15 días después de cada campaña)/Publicaciones en Materia Ambiental en Instagram);Visualizaciones de las Publicaciones en Materia Ambiental en Instagram (medido 15 días después de cada campaña);Número;;Publicaciones en Materia Ambiental en Instagram;Número;;;;;"Lider Sistema de Gestión Ambiental
";"Lider Sistema de Gestión Ambiental
";0-3499;3500-3999;4000-4500;4501-5000;4000;4000;4000;;;;;15/10/2025 22:25;24/02/2025 16:47;Licec Ximena Silva Goyeneche;Edgar Camilo Chacon Matajudios;;;2024;Activo;;;;;;;Resultado;;;;;;Gestión;;;;Elemento;sites/Indicadores2/Lists/Ficha_tecnica_indicadores
235;235;Cumplimiento de Requisitos Legales Ambientales Aplicables;Gerencia de planeación y gestión;Gestión Ambiental;Cumplimiento de Requisitos Legales Ambientales Aplicables;Sostenibilidad;Contribuir a la inclusión, la proyección social y el cuidado del medio ambiente;Estratégico;Eficacia;Anual;1/01/2023;;Serie Única;;Positivo;(Requisitos Legales Ambientales Cumplidos / Requisitos Legales Ambientales Identificados)*100;Requisitos Legales Ambientales Cumplidos;Número;;Requisitos Legales Ambientales Identificados;Número;;-;-;;Lider Sistema de Gestión Ambiental;Lider Sistema de Gestión Ambiental;0%-79,9%;80%  - 99,9%;100%;100%;100%;100%;100%;;;;;15/10/2025 22:25;24/02/2025 16:47;Licec Ximena Silva Goyeneche;Edgar Camilo Chacon Matajudios;;;2024;Activo;;;;;;;Resultado;;;;;;Gestión;;;;Elemento;sites/Indicadores2/Lists/Ficha_tecnica_indicadores
236;236;Actos Administrativos o Decisiones Judiciales Ambientales;Gerencia de planeación y gestión;Gestión Ambiental;Actos Administrativos o Decisiones Judiciales Ambientales;Sostenibilidad;Contribuir a la inclusión, la proyección social y el cuidado del medio ambiente;Estratégico;Eficacia;Anual;1/01/2023;;Serie Única;;Negativo;Actos Administrativos o Decisiones Judiciales Ambientales Desfavorables en Temas Legales Ambientales;Actos Administrativos o Decisiones Judiciales Ambientales Desfavorables en Temas Legales Ambientales;Número;;;;;;;;Lider Sistema de Gestión Ambiental;Líder Sistema de Gestión Ambiental;2;1;0;0;0;0;0;;;;;15/10/2025 22:25;24/02/2025 16:47;Licec Ximena Silva Goyeneche;Edgar Camilo Chacon Matajudios;;;2024;Activo;;;;;;;Resultado;;;;;;Gestión;;;;Elemento;sites/Indicadores2/Lists/Ficha_tecnica_indicadores
237;237;Cumplimiento Proyecto nuevo Polisigs;Gerencia de planeación y gestión;Planificación POLISIGS;;Transformación_Organizacional;Fortalecer la gestión por procesos y la toma de decisiones basada en el análisis de los datos;Gestión;Eficacia;Mensual;;;;;Positivo;TOTAL DE CERTIFICACIOES;TOTAL DE CERTIFICACIOES;Número;;-;-;;;;;GERENCIA DE ESTRATEGIA;GERENCIA DE ESTRATEGIA;;;;;;;;;;;;15/10/2025 22:25;24/02/2025 16:47;Licec Ximena Silva Goyeneche;;;;;Inactivo;;;;;;;;;;;;;Pendiente;;;;Elemento;sites/Indicadores2/Lists/Ficha_tecnica_indicadores
238;238;Cumplimiento de la Protección del Medio Ambiente;Gerencia de planeación y gestión;Gestión Ambiental;Proteger el medio ambiente aplicando controles de prevención, mitigación, corrección y/o compensación, garantizando el uso sostenible de los recursos naturales, la preservación de la biodiversidad y los ecosistemas.;Sostenibilidad;Contribuir a la inclusión, la proyección social y el cuidado del medio ambiente;Estratégico;Eficacia;Trimestral;1/01/2023;;Multiserie;Cumplimiento del Plan Anual del SGA , Gestión Integral de Residuos, Gestión del Ahorro y Uso Eficiente de Energía, Gestión de la Calidad, Ahorro y Uso Eficiente del Agua, Gestión de Áreas Naturales, Gestión de la Medición y Compensación de GEI, Gestión de la Educación y Comunicación Ambiental;Positivo;(Indicadores con Cumplimiento Positivo Aplicables en el Periodo / Indicadores Aplicables en el Periodo)*100;Indicadores con Cumplimiento Positivo Aplicables en el Periodo ;Número;;Indicadores Aplicables en el Periodo;Número;;;;;Lider Sistema de Gestión Ambiental;Lider Sistema de Gestión Ambiental;0%-79,9%;80%  - 89,9%;90% - 100%;100%;90%;90%;90%;;;;;15/10/2025 22:25;24/02/2025 16:47;Licec Ximena Silva Goyeneche;Edgar Camilo Chacon Matajudios;;;2024;Activo;;;;;;;Resultado;;;;;;Gestión;;;;Elemento;sites/Indicadores2/Lists/Ficha_tecnica_indicadores
239;239;Portafolio De Proyectos - Metrica;Gerencia de planeación y gestión;Gestión de proyectos;Identificar el número de proyectos activos por etapa;Transformación_Organizacional;Fortalecer la gestión por procesos y la toma de decisiones basada en el análisis de los datos;Gestión;Eficacia;Mensual;1/01/2023;;Multiserie;Estados (Planificación, Ejecución, Cierre, Finalizados, Stand By);Positivo;N° proyectos (TOTAL PROYECTOS EN PLANIFICACIÓN+TOTAL PROYECTOS EN EJECUCIÓN+TOTAL PROYECTOS EN CIERRE+TOTAL PROYECTOS FINALIZADOS+ TOTAL PROYECTOS STAND BY);N° de proyectos;Número;Consolidado de proyectos;;;;;;;LIDER DE PROYECTOS;LIDER DE PROYECTOS;Metrica;Metrica;Metrica;Metrica;Metrica;Metrica;Metrica;Metrica;Metrica;Metrica;Metrica;20/05/2026 10:56;24/02/2025 16:47;Licec Ximena Silva Goyeneche;Ruben Dario Gelvez Gonzalez;;;2026;Stand by;true;false;true;true;;Modificar Ficha;Resultado;;;;;;Pendiente;;;;Elemento;sites/Indicadores2/Lists/Ficha_tecnica_indicadores
240;240;Cumplimiento De Gestión De Proyectos Cerrados;Gerencia de planeación y gestión;Gestión de proyectos;Garantizar que los proyectos que se cierren cuenten con todas las evidencias de las actividades ejecutadas y los entregables definidos en el caso de negocio;Transformación_Organizacional;Fortalecer la gestión por procesos y la toma de decisiones basada en el análisis de los datos;Gestión;Eficacia;Trimestral;1/01/2023;;Serie Única;0;Positivo;(Proyectos Finalizados Con Evidencias/Proyectos Finalizados)*100;Proyectos finalizados con evidencias;Número;Sitio de proyectos;Proyectos finalizados;Número;Consolidado de proyectos;0;0;0;LIDER DE PROYECTOS;LIDER DE PROYECTOS;0%-79,9%;80%  - 99,9%;100%;100%;100%;100%;100%;;;;;22/04/2026 14:16;24/02/2025 16:47;Licec Ximena Silva Goyeneche;Ruben Dario Gelvez Gonzalez;;;2025;Stand by;false;false;true;true;;Eliminar;Resultado;PDF;Acta de cierre;;;;Gestión;;;;Elemento;sites/Indicadores2/Lists/Ficha_tecnica_indicadores
241;241;Cumplimiento De Gestión De Proyectos Fase Inicio;Gerencia de planeación y gestión;Gestión de proyectos;Garantizar que los proyectos cumplan la etapa de planeación (Caso de negocio y cronograma) previo a la ejecución.;Transformación_Organizacional;Fortalecer la gestión por procesos y la toma de decisiones basada en el análisis de los datos;Gestión;Eficacia;Mensual;1/01/2023;;Serie Única;0;Positivo;(Proyectos Con Fase De Inicio Completa/Proyectos En Ejecución)*100;Proyectos Con Fase De Inicio Completa;Número;Consolidado de proyectos;Proyectos En Ejecución;Número;Consolidado de proyectos;;;;LIDER DE PROYECTOS;LIDER DE PROYECTOS;0%-59,9%;60%  -79,9%;80% -100%;100%;80%;80%;80%;;;;;22/04/2026 14:16;24/02/2025 16:47;Licec Ximena Silva Goyeneche;;;;2024;Activo;false;false;true;true;;Eliminar;Resultado;;;;;;Gestión;;;;Elemento;sites/Indicadores2/Lists/Ficha_tecnica_indicadores
242;242;Cumplimiento A Cronograma De Proyectos;Gerencia de planeación y gestión;Gestión de proyectos;Verificar el índice de cumplimiento de los cronogramas de los proyectos;Transformación_Organizacional;Fortalecer la gestión por procesos y la toma de decisiones basada en el análisis de los datos;Gestión;Eficacia;Mensual;1/01/2023;;Multiserie;"Nombre de proyectos
- Promedio cumplimiento general de los proyectos";Positivo;(% Avance Proyecto/% Esperado Proyecto);% Avance Proyecto;Porcentaje;Cronograma de cada proyecto;% Esperado Proyecto;Porcentaje;Cronograma de cada proyecto;0;0;0;LIDER DE PROYECTOS;LIDER DE PROYECTOS;70,00%;0,7 - 0,9;90%;0,9;;;;;;;;15/10/2025 22:25;24/02/2025 16:47;Licec Ximena Silva Goyeneche;;;;;Inactivo;;;;;;;;;;;;;Pendiente;;;;Elemento;sites/Indicadores2/Lists/Ficha_tecnica_indicadores
243;243;Cumplimiento De Gestión De Proyectos Control De Cambios;Gerencia de planeación y gestión;Gestión de proyectos;Verificar la correcta planeación en terminos de alcance, tiempos y costo de los proyectos.;Transformación_Organizacional;Fortalecer la gestión por procesos y la toma de decisiones basada en el análisis de los datos;Gestión;Eficacia;Mensual;1/01/2023;;Serie Única;;Negativo;Total de proyectos con control de cambios/ Total de proyectos en ejecución;Total De Proyectos Con Control De Cambios;Número;Formato de control de cambios;Total De Proyectos En Ejecución;Número;Consolidado de proyectos;;;;LIDER DE PROYECTOS;LIDER DE PROYECTOS;0;0,2;0,15;10%;0,2;0,2;0,2;;;;;15/10/2025 22:25;24/02/2025 16:47;Licec Ximena Silva Goyeneche;;;;;Inactivo;;;;;;;;;;;;;Pendiente;;;;Elemento;sites/Indicadores2/Lists/Ficha_tecnica_indicadores
244;244;GreenMetric - Nacional;Gerencia de planeación y gestión;Gestión Ambiental;Lograr ubicarnos entre las primeras 20 instituciones de educación superior en el ranking nacional de campus verdes y sostenibilidad ambiental  GreenMetric.;Sostenibilidad;Contribuir a la inclusión, la proyección social y el cuidado del medio ambiente;Estratégico;Eficacia;Anual;31/12/2018;;Serie Única;;Negativo;Ranking nacional de campus verdes y sostenibilidad ambiental GreenMetric;Ranking nacional de campus verdes y sostenibilidad ambiental GreenMetric;Número;GreenMetric;;;;;;;Lider Sistema de Gestión Ambiental;Lider Sistema de Gestión Ambiental;29;27;25;23;25;25;25;;;;;15/10/2025 22:25;24/02/2025 16:47;Licec Ximena Silva Goyeneche;Edgar Camilo Chacon Matajudios;;;2024;Activo;true;false;;false;;Activo;Resultado;;;;;;Estratégico;;;;Elemento;sites/Indicadores2/Lists/Ficha_tecnica_indicadores
245;245;Tasa de Permanencia Intersemestral;Vicerrectoría del estudiante;Permanencia;"Mide la proporción de estudiantes que continúan su proceso formativo en la institución entre dos periodos académicos consecutivos.
Se calcula dividiendo el número de estudiantes rematriculados más los egresados entre el número de estudiantes matriculados en el periodo anterior.";Experiencia;Garantizar una experiencia significativa y de valor agregado a la comunidad POLI;Estratégico;Eficacia;Semestral;1/01/2023;;Serie Única;;Positivo;(Número de estudiantes rematriculados + egresados/Número de estudiantes matriculados en el periodo anterior)*100;Número de estudiantes rematriculados + egresados;Número;Novus- Tablero de permanencia;Número de estudiantes matriculados en el periodo anterior;Número;Novus- Tablero de permanencia;;;;Gerente de Servicio y Permanencia, Director de Permanencia;Gerente de Servicio y Permanencia, Director de Permanencia;0%-79,9%;80%-99,9%;100%;>101%;86%;86,6%;86%;;;;;27/05/2026 10:09;24/02/2025 16:47;Licec Ximena Silva Goyeneche;Andres Felipe Correa Franco;;;2026;Stand by;true;false;true;true;;Modificar Ficha;Resultado;Imagen;Print de Tablero de permanencia;;;;Estratégico;Factor 11. Comunidad de estudiantes;Característica 34. Admisión y permanencia de estudiantes;Estrategia institucional para la permanencia;Elemento;sites/Indicadores2/Lists/Ficha_tecnica_indicadores
246;246;Satisfacción del proceso de grados presencial;Vicerrectoría del estudiante;Registro y Control;Medir el nivel de satisfacción del proceso de grado presencial 2024;Experiencia;Garantizar una experiencia significativa y de valor agregado a la comunidad POLI;Estratégico;Eficacia;Semestral;1/01/2023;;Serie Única;;Positivo;Resultado de la encuesta de satisfacción del proceso de grado;Resultado de la encuesta de satisfacción del proceso de grado;Porcentaje;;;;;;;;"Director Nac Admisiones, Registro y Cont
";"Director Nac Admisiones, Registro y Cont
";0%-69.99%;70%  - 84,99%;85%-95%;>95%;85%;85%;85%;;;;;14/05/2026 13:12;24/02/2025 16:47;Licec Ximena Silva Goyeneche;Luz Marina Cuellar Trillos;;;2026;Stand by;false;false;true;true;;Actualizar Metas;Resultado;;;;;;Gestión;;;;Elemento;sites/Indicadores2/Lists/Ficha_tecnica_indicadores
247;247;Solicitud de certificados;Vicerrectoría del estudiante;Registro y Control;Medir el nivel de cumplimiento en la solicitud de certificados de 1er y 2do nivel;Transformación_Organizacional;Fortalecer la gestión por procesos y la toma de decisiones basada en el análisis de los datos;Gestión;Eficacia;Mensual;1/01/2023;;Multiserie;(1er Nivel Autogestión- 2do Nivel Manual);Positivo;"Cantidad de certificados emitidos/ Total de certificados solicitados 
(1er Nivel Autogestión- 2do Nivel Manual)";Cantidad de certificados emitidos;Número;;Total de certificados solicitados;Número;;;;;Director de registro y control;Director de registro y control;;;;;;;;;;;;15/10/2025 22:25;24/02/2025 16:47;Licec Ximena Silva Goyeneche;;;;;Inactivo;;;;;;;;;;;;;Pendiente;;;;Elemento;sites/Indicadores2/Lists/Ficha_tecnica_indicadores
248;248;Programas Con Reforzamiento Curricular;Vicerrectoría académica;Gestión, evaluación e innovación curricular;Identificar los programas con reforzamiento curricular planteados vs ejecutados;Calidad;Fortalecer la oferta educativa y la innovación curricular ;Estratégico;Eficacia;Semestral;1/01/2023;;Serie Única;0;Positivo;N° de Programas con reforzamiento curricular/N° total de programas;N° de Programas con reforzamiento curricular;Número;;N° total de programas;Número;;;;;Director de Curriculo Presencial y Virtual;Director de Curriculo Presencial y Virtual;0%-79.99%;80%  - 99,99%;100%;101%;;;;;;;;15/10/2025 22:25;24/02/2025 16:47;Licec Ximena Silva Goyeneche;;;;;Inactivo;;;;;;;;;;;;;Pendiente;;;;Elemento;sites/Indicadores2/Lists/Ficha_tecnica_indicadores
249;249;Programas Con Matriz De Resultado De Aprendizaje;Vicerrectoría académica;Gestión, evaluación e innovación curricular;Identificar en número de programas con matriz de resultados de aprendizaje completa;Calidad;Fortalecer la oferta educativa y la innovación curricular ;Estratégico;Eficacia;Semestral;1/01/2023;;Serie Única;;Positivo;N° de programas con matriz de resutados de aprendizaje/N° Total De Programas;N° de programas con matriz de resutados de aprendizaje;Número;;N° Total De Programas;Número;;;;;Lider de Curriculo;Lider de Curriculo;0%-79.99%;80%  - 99,99%;100%;101%;;;;;;;;15/10/2025 22:25;24/02/2025 16:47;Licec Ximena Silva Goyeneche;;;;;Inactivo;;;;;;;;;;;;;Pendiente;;;;Elemento;sites/Indicadores2/Lists/Ficha_tecnica_indicadores
250;250;Cumplimiento de cronograma de reportes de planes anuales;Gerencia de planeación y gestión;Planeación Estratégica;Realizar el seguimiento de los cronogramas de reportes de planes anuales;Transformación_Organizacional;Fortalecer la gestión por procesos y la toma de decisiones basada en el análisis de los datos;Gestión;Eficacia;Trimestral;1/06/2023;;Serie Única;;Positivo;Número de áreas con reportes realizados/Total de áreas a reportar*100;Número de áreas con reportes realizados;Número;Plan de retos;Total de áreas a reportar;Número;Plan de retos;;;;Especialista de planeación estratégica;Especialista de planeación estratégica;0%-79.99%;80%  - 99,99%;100%;101%;;;;;;;;15/10/2025 22:25;24/02/2025 16:47;Licec Ximena Silva Goyeneche;;;;;Inactivo;;;;;;;;;;;;;Pendiente;;;;Elemento;sites/Indicadores2/Lists/Ficha_tecnica_indicadores
251;251;Subprocesos Con CMI Estructurado.;Gerencia de planeación y gestión;Desempeño Institucional;Identificar el número de procesos con CMI Cuadros de mando integral definidos sobre el total de subprocesos activos;Transformación_Organizacional;Fortalecer la gestión por procesos y la toma de decisiones basada en el análisis de los datos;Gestión;Eficacia;Trimestral;1/07/2023;31/12/2024;Serie Única;;Positivo;Número de procesos con CMI estructurados/Número de procesos totales;Número de procesos con CMI estructurados;Número;Consolidado de indicadores;Número de procesos totales;Número;Consolidado de indicadores;;;;Especialista de medición y mejora;Especialista de medición y mejora;0%-61%;61%  - 79,99%;80% -99,9%;100%;80%;80%;80%;;;;;23/04/2026 7:44;24/02/2025 16:47;Licec Ximena Silva Goyeneche;Licec Ximena Silva Goyeneche;;;2024;Stand by;false;false;true;true;;Eliminar;Resultado;;;;;;Gestión;;;;Elemento;sites/Indicadores2/Lists/Ficha_tecnica_indicadores
252;252;Tasa de Permanencia Intersemestral de Estudiantes Ingresantes;Vicerrectoría del estudiante;Permanencia;Mide el porcentaje de estudiantes que ingresan por primera vez a la institución en un periodo académico y que continúan matriculados en el periodo académico inmediato siguiente. ;Experiencia;Garantizar una experiencia significativa y de valor agregado a la comunidad POLI;Estratégico;Eficacia;Semestral;1/01/2023;;Serie Única;;Positivo;(Tasa de permanencia ingresantes real periodo/Tasa de permanencia ingresantes esperada)*100;"Tasa de permanencia ingresantes real periodo	";Porcentaje;Novus Tablero de permanencia;"Tasa de permanencia ingresantes esperada	";Porcentaje;;;;;Gerente de Servicio y Permanencia, Director de Permanencia;Gerente de Servicio y Permanencia, Director de Permanencia;0%-79,9%;80%-99,9%;100%;>101%;74,8%;71,6%;74,8%;;;;;27/05/2026 10:15;24/02/2025 16:47;Licec Ximena Silva Goyeneche;Andres Felipe Correa Franco;;;2026;Stand by;false;false;true;true;;Modificar Ficha;Resultado;Imagen;Print Tablero de permanencia;;;;Gestión;Factor 11. Comunidad de estudiantes;Característica 34. Admisión y permanencia de estudiantes;Estrategia institucional para la permanencia;Elemento;sites/Indicadores2/Lists/Ficha_tecnica_indicadores
253;253;Oportunidad en la entrega de informes de auditoria;Gerencia de planeación y gestión;Auditoría Interna;Medir el nivel de cumplimiento en la entrega de informes de auditoria;Transformación_Organizacional;Fortalecer la gestión por procesos y la toma de decisiones basada en el análisis de los datos;Gestión;Eficacia;Bimensual;1/01/2023;;Serie Única;;Positivo;N° de días entre el cierre de la auditoria y la entrega del informe;N° de días entre el cierre de la auditoria y la entrega del informe;Número;Informe de auditoria;N° de días acuerdo de servicio;Número;Informe de auditoria;;;;Director de Auditoria Interna;Director de Auditoria Interna;0;0,01%  - 69,99%;70%;100%;0;0;0;;;;;15/10/2025 22:25;24/02/2025 16:47;Licec Ximena Silva Goyeneche;;;;;Inactivo;;;;;;Eliminado;;;;;;;Pendiente;;;;Elemento;sites/Indicadores2/Lists/Ficha_tecnica_indicadores
254;254;Áreas con reportes de plan de retos;Gerencia de planeación y gestión;Planeación Estratégica;Identificar el número de áreas que reportaron el avance del plan de retos dentro de los tiempos establecidos;Transformación_Organizacional;Fortalecer la gestión por procesos y la toma de decisiones basada en el análisis de los datos;Gestión;Eficacia;Trimestral;1/01/2023;;Serie Única;;Positivo;"(Número de áreas con reporte de plan de retos realizado oportunamente/Número de áreas con Plan de retos definido	)*100";"Número de áreas con reporte de plan de retos realizado oportunamente	";Número;Herramienta de retos;"Número de áreas con Plan de retos definido	";Número;Herramienta de retos;;;;Especialista de planeación estratégica;Especialista de planeación estratégica;0%-50%;70%  - 89,99%;95% -100%;100%;100%;100%;100%;;;;;15/10/2025 22:25;24/02/2025 16:47;Licec Ximena Silva Goyeneche;;;;2024;Activo;false;false;false;false;;Actualizar Metas;Resultado;;;;;;Gestión;;;;Elemento;sites/Indicadores2/Lists/Ficha_tecnica_indicadores
255;255;Informe anual de variación de índice H - Metrica;Vicerrectoría académica;Editorial y Publicaciones;Identificar la variación del indice (H1 - H5);Calidad;Asegurar la alta calidad a nivel institucional;Estratégico;Eficacia;Anual;1/01/2023;;Multiserie;"H1 Revistas
H5 Revistas
H10 Revistas
H1 Libros
H5 Libros
H10 Libros
";Positivo;N° de citas en el mayor número de libros Indice h5 año actual-Indice h5 año anterior;N° de citas en el mayor número de libros Indice h5 año actual;Número;Informe anual de variación de indice H5 (Google Academics);;;;;;;Director Editorial;Director Editorial;Metrica;Metrica;Metrica;Metrica;Metrica;Metrica;Metrica;;;;;2/06/2026 10:11;24/02/2025 16:47;Licec Ximena Silva Goyeneche;Eduardo Norman Acevedo;;;2025;Stand by;false;false;false;false;;Pendiente;Seleccione;Imagen;Google Academics;;;;Pendiente;;;;Elemento;sites/Indicadores2/Lists/Ficha_tecnica_indicadores
256;256;Publicaciones editadas por la editorial;Vicerrectoría académica;Editorial y Publicaciones;Mide el número de publicaciones editadas por la editorial;Calidad;Asegurar la alta calidad a nivel institucional;Gestión;Eficacia;Semestral;1/01/2023;;Serie Única;;Positivo;(Nuevas publicaciones incluidas en el año/Meta de publicaciones por periodo)*100;Nuevas publicaciones incluidas en el año;Número;Plan Editorial;Meta de publicaciones por periodo;Número;;;;;Director Editorial;Director Editorial;0%-79,99%;80%  - 99,99%;100%;100.01%;28;14;14;;;;;2/06/2026 10:09;24/02/2025 16:47;Licec Ximena Silva Goyeneche;Guillermo Alberto Gonzalez Triana;;;2026;Stand by;false;false;false;false;;Actualizar Metas;Resultado;Excel;Consolidado de ISBN;;;;Gestión;;;;Elemento;sites/Indicadores2/Lists/Ficha_tecnica_indicadores
257;257;N° de publicaciones aprobadas en convocatorias;Vicerrectoría académica;Editorial y Publicaciones;Identificar el nivel de aprobación de las publicaciones;Calidad;Asegurar la alta calidad a nivel institucional;Gestión;Eficacia;Semestral;1/01/2023;;Serie Única;;Positivo;N° eventos en que participo la editorial/ N° de eventos planeados;N° eventos en que participo la editorial;Número;;N° de eventos planeados;Número;;;;;Director Editorial;Director Editorial;0%-79.99%;80%  - 99,99%;100%;>101%;;;;;;;;2/06/2026 10:02;24/02/2025 16:47;Licec Ximena Silva Goyeneche;;;;;Inactivo;;;;;;;;;;;;;Pendiente;;;;Elemento;sites/Indicadores2/Lists/Ficha_tecnica_indicadores
258;258;N° de publicaciones incluidas para indexación;Vicerrectoría académica;Editorial y Publicaciones;Medir el número de publicaciones incluidas para indexación;Calidad;Asegurar la alta calidad a nivel institucional;Gestión;Eficacia;Anual;1/01/2023;;Serie Única;;Positivo;Numero de publicaciones indexadas en sires, bases de datos e indices bibliograficos/N° Total de nuevas publicaciones*100;Numero de publicaciones indexadas en sires, bases de datos e indices bibliograficos;Número;;N° Total de nuevas publicaciones*100;Número;;;;;Director Editorial;Director Editorial;0%-79.99%;80%  - 99,99%;100%;>101%;;;;;;;;2/06/2026 10:02;24/02/2025 16:47;Licec Ximena Silva Goyeneche;;;;;Inactivo;;;;;;;;;;;;;Pendiente;;;;Elemento;sites/Indicadores2/Lists/Ficha_tecnica_indicadores
